{
  "schema_version": "1.0",
  "request_id": "example-measures-001",
  "text": "Un escritorio de 1.80 m de ancho, estructura de 18 mm y mesón de 25 mm",
  "language": "es",
  "expected_item_type": "MUEBLE_MEDIDA",
  "currency_context": "USD",
  "domain_profile_version": null,
  "transcription": null
}
